{
  "plan_name": "饮食健康处方",
  "plan_title": "个性化控糖减重饮食建议",
  "plan_summary": "结合患者2型糖尿病、体重偏高、餐后血糖波动和夜班外卖较多的情况，本方案围绕主食控制、蛋白质搭配、控油控盐、夜班外食和饮食记录提供可执行建议。",
  "execution_points": "优先落实重点执行条目；饮食调整以规律、可持续为原则；如出现低血糖、连续血糖异常或明显不适，应及时联系医生或健管师。",
  "groups": [
    {
      "group_title": "主食与血糖管理",
      "items": [
        {
          "content": "每餐主食先控制在固定份量，优先用全谷物、杂豆或薯类替代部分精白米面。",
          "focus_point": "重点降低餐后血糖波动；调整初期建议同步记录餐后血糖变化。",
          "importance": "重点执行"
        }
      ]
    },
    {
      "group_title": "外食与夜班饮食策略",
      "items": [
        {
          "content": "夜班或点外卖时优先选择少油烹饪、带蔬菜和优质蛋白的套餐，减少卤味、油炸和甜饮。",
          "focus_point": "患者外卖频率较高，先从选择规则入手比完全禁止更容易长期执行。",
          "importance": "重点执行"
        }
      ]
    }
  ]
}

