{
  "plan_name": "运动健康处方",
  "plan_title": "个性化控糖减重运动建议",
  "plan_summary": "结合患者2型糖尿病、体重偏高、日常步数偏少和夜班时间不规律的情况，本方案围绕有氧运动、抗阻训练、碎片化执行和运动安全监测提供可执行建议。",
  "execution_points": "优先落实重点执行条目；运动调整以循序渐进、可长期坚持为原则；如出现低血糖表现、胸闷胸痛、明显头晕或血压明显异常，应停止运动并联系医生或健管师。",
  "groups": [
    {
      "group_title": "有氧运动安排",
      "items": [
        {
          "content": "每周安排5天慢走或快走，每次20-30分钟，从饭后1小时左右、身体状态平稳时开始。",
          "focus_point": "帮助改善餐后血糖和体重管理；如运动后出现明显不适，应降低强度并反馈健管师。",
          "importance": "重点执行"
        }
      ]
    },
    {
      "group_title": "碎片化运动策略",
      "items": [
        {
          "content": "夜班或忙碌时，把运动拆成3次完成，每次8-10分钟，可选择走廊快走、原地踏步或轻量拉伸。",
          "focus_point": "适配整块时间不足的场景，先提高运动频率，再逐步增加总时长。",
          "importance": "重点执行"
        }
      ]
    }
  ]
}

